{
    "protocol":  "baijin-codex-bridge-request/1.0",
    "request_id":  "request-review-001",
    "bridge_type":  "review_bridge",
    "repository":  "shunhang776/xinbaijin-mcp",
    "branch":  "dev",
    "codex_role":  "bridge",
    "candidate_commit":  "1111111111111111111111111111111111111111",
    "review_commit":  null,
    "repair_commit":  null,
    "verdict":  null,
    "trigger_key":  "REVIEW_MCP_LATEST_HANDOFF",
    "findings":  [

                 ],
    "repair_round":  0,
    "max_repair_round":  2,
    "expected_next_actor":  "chatgpt-baijin-reviewer",
    "forbidden_actions":  [
                              "do not review code",
                              "do not write review.json",
                              "do not bypass ChatGPT review",
                              "do not bypass gate"
                          ],
    "created_at":  "2026-06-27T06:24:49.833Z"
}



