{
    "protocol":  "baijin-codex-bridge-request/1.0",
    "request_id":  "request-repair-001",
    "bridge_type":  "repair_bridge",
    "repository":  "shunhang776/xinbaijin-mcp",
    "branch":  "dev",
    "codex_role":  "bridge",
    "candidate_commit":  "1111111111111111111111111111111111111111",
    "review_commit":  "2222222222222222222222222222222222222222",
    "repair_commit":  null,
    "verdict":  "changes_requested",
    "trigger_key":  null,
    "findings":  [
                     {
                         "severity":  "medium",
                         "file":  "worker.js",
                         "line":  1,
                         "title":  "sample finding",
                         "recommendation":  "bridge to claude-code"
                     }
                 ],
    "repair_round":  1,
    "max_repair_round":  2,
    "expected_next_actor":  "claude-code",
    "forbidden_actions":  [
                              "do not modify code",
                              "do not modify review.json",
                              "do not commit",
                              "do not push"
                          ],
    "created_at":  "2026-06-27T06:24:49.833Z"
}



